{"$schema":"https://json-schema.org/draft/2020-12/schema","additionalProperties":false,"description":"JSON Schema for swiftcode.json (manifestVersion 1). This schema is the formalization of Docs/Intro-to-SDK.md §7 and the fixed Phase 1 decisions in SwiftCode/SDK/Documentation/SDK-Architecture.md (capability IDs ADR §7, error codes ADR §8). Forward compatibility is handled by explicit new schema versions (manifestVersion 2, new file), NOT by silent extra fields: additionalProperties is false at the top level and on capability/command objects. Constraints that cannot be expressed in draft 2020-12 (duplicate capability/command ids, entrypoint file existence, package-level checks from spec §7.2) are enforced by the strict manifest/package validator (Phase 1 work item P1b), not by this schema.","properties":{"$schema":{"description":"Pointer to the schema this manifest was authored against. In a packaged extension this MUST point to the schema file shipped with the SDK inside the extension package (e.g. \"./schemas/swiftcode-extension-v1.schema.json\") or a verified official URL. Dead URLs are rejected at install time per spec §7.1.","type":"string"},"assist":{"additionalProperties":false,"description":"Assist-related declaration. DESCRIPTIVE METADATA ONLY in this release: a manifest \"assist\": {\"requested\": true} does NOT grant Assist access. Assist is unavailable to extensions, period (ADR §9): any assist.invoke request -> typed ASSIST_DENIED + audit event. The future Assist authorization flow is not implemented and no dormant bypass is added.","properties":{"requested":{"description":"Whether the extension declares interest in Assist capabilities. False for the first extension.","type":"boolean"}},"required":["requested"],"type":"object"},"capabilities":{"description":"Capability grant requests. A valid manifest is a request, not an authorization token: each id still requires an explicit user grant via the CapabilityBroker, and unknown ids are rejected with UNKNOWN_CAPABILITY (never silently reinterpreted). Duplicate ids are rejected by the host validator; this schema cannot express per-property uniqueness inside arrays.","items":{"additionalProperties":false,"properties":{"id":{"description":"Capability IDs from the canonical SwiftCode SDK capability registry (SDKCapability.swift / ScopesIDLists.ts). No other ids may appear.","enum":["project.read","workspace.read","workspace.write","source-control.read","source-control.write","build.execute","task.execute","network.request","ui.contribute","credentials.use","use.Security","use.Security.keychain","use.Security.audit","use.Security.crypto","use.Security.securePrompt","use.Security.redaction","use.Security.policy","assist.invoke","db.ExploreView","ci.VisualWF","sandbox.view","virtualization.view","deployConsole.view","use.SwiftCodeModel","terminal.sandbox","simulator.view","preview.live","uibuilder.open","symbols.browse","docs.search","dictionary.open","deviceconnect.open"],"type":"string"},"reason":{"description":"Non-empty, plain-language justification shown to the user in the grant approval UI.","maxLength":500,"minLength":1,"type":"string"}},"required":["id","reason"],"type":"object"},"maxItems":32,"minItems":1,"type":"array"},"contributes":{"additionalProperties":false,"description":"UI contributions. In this release only the command model is supported (no arbitrary native UI injection). Today's CommandPaletteView.CommandAction enum is closed, so command contributions need a new open registry on the host side.","properties":{"commands":{"description":"Contributed commands. Command ids must be unique within the array; uniqueness is enforced by the host validator (not expressible per-property in this draft).","items":{"additionalProperties":false,"properties":{"id":{"description":"Machine identifier for the command, lowercase alphanumeric plus hyphens.","maxLength":64,"pattern":"^[a-z0-9-]+$","type":"string"},"title":{"description":"Human-readable command title shown in the UI.","maxLength":128,"minLength":1,"type":"string"}},"required":["id","title"],"type":"object"},"maxItems":64,"minItems":1,"type":"array"}},"required":["commands"],"type":"object"},"description":{"maxLength":1000,"type":"string"},"id":{"description":"Reverse-DNS extension identifier, e.g. \"com.example.repository-build-extension\". Used as the install-directory name and the identity bound to the runtime session; extension-supplied identity is never trusted beyond this validated value.","maxLength":128,"pattern":"^[A-Za-z][A-Za-z0-9-]*(\\.[A-Za-z][A-Za-z0-9-]*)+$","type":"string"},"manifestVersion":{"const":1,"description":"Manifest schema generation. This file defines generation 1. Unsupported generations are rejected with MANIFEST_UNSUPPORTED_VERSION.","type":"integer"},"name":{"maxLength":128,"minLength":1,"type":"string"},"runtime":{"additionalProperties":false,"properties":{"entrypoint":{"description":"Path of the entrypoint file RELATIVE to the package root. Must not be absolute and must not contain \"..\" segments; escaping the package root is rejected with PATH_TRAVERSAL. Existence inside the validated package is checked at install time (schema cannot check the filesystem).","maxLength":256,"pattern":"^(?![/\\\\])(?!.*\\.\\.)[^\\x00]+$","type":"string"},"language":{"description":"Only TypeScript extensions are supported in this release (Python deferred per ADR §12).","enum":["typescript"],"type":"string"},"minimumSwiftCodeVersion":{"description":"Minimum host SwiftCode version this extension requires (semver).","maxLength":64,"pattern":"^(0|[1-9]\\d*)\\.(0|[1-9]\\d*)\\.(0|[1-9]\\d*)(-((0|[1-9]\\d*|\\d*[a-zA-Z-][0-9a-zA-Z-]*)(\\.(0|[1-9]\\d*|\\d*[a-zA-Z-][0-9a-zA-Z-]*))*))?(\\+([0-9a-zA-Z-]+(\\.[0-9a-zA-Z-]+)*))?$","type":"string"}},"required":["language","entrypoint","minimumSwiftCodeVersion"],"type":"object"},"sdk":{"additionalProperties":false,"properties":{"name":{"const":"@swiftcode/sdk","description":"The SDK package name this extension is built against.","type":"string"},"protocolVersion":{"const":1,"description":"Host/runtime IPC contract version. Mismatches are rejected with IPC_PROTOCOL_MISMATCH.","type":"integer"},"versionRange":{"description":"npm-style semver range for the SDK version, e.g. \"^1.0.0\". Incompatible ranges are rejected with INCOMPATIBLE_SDK_VERSION. This schema checks the character set only; real range satisfaction is evaluated by the host validator.","maxLength":64,"minLength":1,"pattern":"^[\\^~>=<\\d\\.\\-xX\\*\\|\\s,]+$","type":"string"}},"required":["name","versionRange","protocolVersion"],"type":"object"},"type":{"enum":["extension","app"],"description":"Package kind. \"extension\" contributes commands and UI to the host; \"app\" is a standalone package shipped in the identical .swiftcode-extension format (same archive layout, digest, and install directory) and distinguished by this field at runtime.","type":"string"},"version":{"description":"Full semver 2.0.0 of the extension package.","maxLength":64,"pattern":"^(0|[1-9]\\d*)\\.(0|[1-9]\\d*)\\.(0|[1-9]\\d*)(-((0|[1-9]\\d*|\\d*[a-zA-Z-][0-9a-zA-Z-]*)(\\.(0|[1-9]\\d*|\\d*[a-zA-Z-][0-9a-zA-Z-]*))*))?(\\+([0-9a-zA-Z-]+(\\.[0-9a-zA-Z-]+)*))?$","type":"string"}},"required":["manifestVersion","id","name","version","type","runtime","sdk","capabilities"],"title":"SwiftCode Extension Manifest","type":"object"}
