{"$schema":"./schemas/swiftcode-extension-v1.schema.json","assist":{"requested":false},"capabilities":[{"id":"source-control.read","reason":"Display repository status and diffs."},{"id":"build.execute","reason":"Run builds through SwiftCode's managed build service."}],"contributes":{"commands":[{"id":"inspect-repository","title":"Inspect Repository"},{"id":"run-build","title":"Build Current Project"}]},"description":"Reads repository status and runs a SwiftCode-managed build.","id":"com.example.repository-build-extension","manifestVersion":1,"name":"Repository Build Extension","runtime":{"entrypoint":"dist/index.js","language":"typescript","minimumSwiftCodeVersion":"1.0.0"},"sdk":{"name":"@swiftcode/sdk","protocolVersion":1,"versionRange":"^1.0.0"},"type":"extension","version":"0.1.0"}