{"$schema":"./schemas/swiftcode-extension-v1.schema.json","assist":{"requested":false},"capabilities":[{"id":"source-control.read","reason":"Display repository status and diffs."},{"id":"build.execute","reason":"Run builds through SwiftCode's managed build service."}],"contributes":{"commands":[{"id":"inspect-repository","title":"Inspect Repository"},{"id":"run-build","title":"Build Current Project"}]},"description":"__EXTENSION_DESCRIPTION__","id":"__EXTENSION_ID__","manifestVersion":1,"name":"__EXTENSION_NAME__","runtime":{"entrypoint":"dist/index.js","language":"typescript","minimumSwiftCodeVersion":"1.0.0"},"sdk":{"name":"@swiftcode/sdk","protocolVersion":1,"versionRange":"^1.0.0"},"type":"extension","version":"__EXTENSION_VERSION__"}